Revelations,Check,Source documents & publications,Intelligence agencies,Countries,Authorisation for surveillance,Codename of surveillance programme(s),Type of surveillance,Type of data collected,Data collection source
FISA Court Order Demanding US call records from Verizon,,https://freesnowden.is/revelations#fisa-court-order-demanding-us-call-records ,NSA,US,,,,,
PRISM: an NSA partnership with US service providers,,https://freesnowden.is/revelations#prism-an-nsa-partnership-with-us-service-providers ,NSA,Global,,,,,
Presidential Directive orders cyber-offensive targeting overseas,,https://freesnowden.is/revelations#presidential-directive-orders-cyber-offensive-targeting-overseas ,NSA,Global,,,,,
Boundless Informant illustrates NSA's global reach,,https://freesnowden.is/revelations#boundless-informant ,NSA,Global,,,,,
"NSA targets universities, mobile phones and fibre-optic network in China",,https://freesnowden.is/revelations#nsa-targets-universities-mobile-phones-in-China ,NSA,China,,,,,
How NSA decides what counts as US data,,https://freesnowden.is/revelations#faa-targeting-and-minimization ,NSA,US,,,,,
GCHQ's cable-tapping Tempora operation,,https://freesnowden.is/revelations#gchq-tempora-porgramme ,GCHQ,Global,,,,,
Internal investigation of post-9/11 warrantless wiretapping,,https://freesnowden.is/revelations#internal-investigation-of-post-9/11-warrantless-wiretapping-program ,NSA,US,,,,,
Authorisation for NSA analysis of US-based electronic metadata,,https://freesnowden.is/revelations#authorization-for-nsa-analysis ,NSA,US,,,,,
Extended data collection: EvilOlive and ShellTrumpet,,https://freesnowden.is/revelations#extended-data-collection ,NSA,US,,,,,
PRISM data acquisition,,https://freesnowden.is/revelations#prism-data-aquisition ,"NSA, FBI, CIA",Global,,,,,
"Large scale NSA activity in Germany, with domestic cooperation",,https://freesnowden.is/revelations#nsa-in-germany ,"NSA, BND",Germany,,,,,
XKeyScore – the NSA search tool for “nearly everything”,,https://freesnowden.is/revelations#xkeyscore-the-nsa-search-tool-for-nearly-everything ,NSA,Global,,,,,
NSA Section 702: targeting US persons,,https://freesnowden.is/revelations#nsa-section-702-targeting-us-persons ,NSA,US,,,,,
NSA auditing and the FISC Opinion,,https://freesnowden.is/revelations#nsa-auditing-and-the-fisc-opinion ,NSA,US,,,,,
US Intelligence Community Budget for 2013,,https://freesnowden.is/revelations#us-intelligence-community-budget ,N/A,US,,,,,
Smartphone surveillance,,https://freesnowden.is/revelations#smartphone-surveillance ,"NSA, GCHQ",Global,,,,,
India a top target,,https://freesnowden.is/revelations#india-a-top-target ,NSA,India,,,,,
Social networks of US citizens retrieved and analysed,,https://freesnowden.is/revelations#social-networks ,NSA,US,,,,,
NSA collects email address books and buddy lists,,https://freesnowden.is/revelations#nsa-collects-email-address-books ,NSA,Global,,,,,
GCHQ's attempts to keep its mass surveillance secret,,https://freesnowden.is/revelations#gchq-efforts-to-keep-mass-surveillance-secret ,GCHQ,UK,,,,,
Sixty million calls gathered from Spain,,https://freesnowden.is/revelations#Sixty-million-calls-gathered-from-Spain ,NSA,Spain,,,,,
NSA and GCHQ break into Yahoo and Google data centres,,https://freesnowden.is/revelations#nsa-and-gchq-break-into-yahoo-and-google-data-centres ,"NSA, GCHQ",Global,,,,,
Venezuela named as a key NSA target,,https://freesnowden.is/revelations#venezuela-named-as-a-key-nsa-target ,NSA,Venezuela,,,,,
Thirty three million Norwegian phone calls logged,,https://freesnowden.is/revelations#thirty-three-million-norwegian-phone-calls-logged ,NSA,Norway,,,,,
NSA retains information on UK citizens,,https://freesnowden.is/revelations#nsa-retains-information-on-uk-citizens ,NSA,UK,,,,,
NSA collects data “against” countries,Maybe?,https://freesnowden.is/revelations#nsa-collects-data-against-countries ,NSA,"Norway, Afghanistan",,,,,
NSA's ambitious four-year goals,Maybe?,https://freesnowden.is/revelations#nsas-ambitious-four-year-goals ,NSA,Global,,,,,
The Netherlands an NSA target since 1946,Maybe?,https://freesnowden.is/revelations#the-netherlands-an-nsa-target-since-1946 ,NSA,The Netherlands,,,,,
Microsoft data centres may also have been NSA targets,,https://freesnowden.is/revelations#microsoft-data-centres-may-also-have-been-nsa-targets ,NSA,Global,,,,,
CSEC's methodology explained,,https://freesnowden.is/revelations#csecs-methodology-explained ,CSEC,Canada,,,,,
Australia offered to share citizens' data with the NSA,,https://freesnowden.is/revelations#australia-offered-to-share-citizens-data-with-the-nsa ,"ASD, NSA",Australia,,,,,
NSA collecting phone location data on an unprecedented scale,,https://freesnowden.is/revelations#nsa-collecting-phone-location-data-on-an-unprecedented-scale ,NSA,Global,,,,,
"Italian leadership, embassy and public targeted by the NSA",,https://freesnowden.is/revelations#italian-leadership-embassy-and-public-targeted-by-the-nsa ,NSA,Italy,,,,,
"Sweden's FRA engages in offensive operations, has access to XKeyScore",,https://freesnowden.is/revelations#swedens-fra-engages-in-offensive-operations-has-access-to-xkeyscore ,"FRA, NSA",Sweden,,,,,
NSA and others can listen in on GSM phone conversations,,https://freesnowden.is/revelations#nsa-and-others-can-listen-in-to-gsm-phone-conversations ,NSA,Global,,,,,
NSA Tailored Access Operations' software and hardware attacks explained,,https://freesnowden.is/revelations#nsa-tailored-access-operations-software-and-hardware-attacks-explained ,NSA,Global,,,,,
NSA trying to build quantum computer,,https://freesnowden.is/revelations#nsa-trying-to-build-quantum-computer ,NSA,Global,,,,,
NSA has two data centres in China,,https://freesnowden.is/revelations#nsa-has-two-data-centres-in-china ,NSA,China,,,,,
200 million text messages a day collected and analysed,,https://freesnowden.is/revelations#200-million-text-messages-a-day-collected-and-analysed ,"NSA, GCHQ",Global,,,,,
US wanted spying on Germany kept secret until 2086,,https://freesnowden.is/revelations#us-wanted-spying-on-germany-kept-secret-until-2086 ,NSA,Germany,,,,,
Personal data from “leaky” smartphone apps targeted by NSA and GCHQ,,https://freesnowden.is/revelations#personal-data-from-leaky-smartphone-apps-targeted-by-nsa-and-gchq ,"NSA, GCHQ",Global,,,,,
GCHQ monitoring and manipulating social media activity in real time,,https://freesnowden.is/revelations#gchq-monitoring-and-manipulating-social-media-activity-in-real-time ,GCHQ,Global,,,,,
Airport wifi used to track Canadian air travellers,,https://freesnowden.is/revelations#airport-wifi-used-to-track-canadian-air-travellers ,CSEC,Canada,,,,,
How GCHQ uses “dirty tricks” against its targets,,https://freesnowden.is/revelations#how-gchq-uses-dirty-tricks ,GCHQ,Global,,,,,
ASD violates legal privilege and shares data with NSA,,https://freesnowden.is/revelations#asd-violates-legal-privilege-and-shares-data-with-nsa ,"ASD, NSA",Australia,,,,,
GCHQ engages in misinformation campaigns and subverts online discourse,,https://freesnowden.is/revelations#gchq-engages-in-misinformation-campaigns-and-subverts-online-discourse ,GCHQ,Global,,,,,
Webcam images intercepted and retained by GCHQ,,https://freesnowden.is/revelations#webcam-images-intercepted-and-retained-by-gchq ,GCHQ,Global,,,,,
NSA agony aunt reveals officials' own concerns about mass surveillance,,https://freesnowden.is/revelations#nsa-agony-aunt-reveals-officials-own-concerns-about-mass-surveillance ,NSA,US,,,,,
How the FISA Court developed secret legal doctrine allowing mass surveillance,,https://freesnowden.is/revelations#how-the-fisa-court-developed-secret-legal-doctrine-allowing-mass-surveillance ,NSA,US,,,,,
NSA storing entire countries' phone communications for 30 days,,https://freesnowden.is/revelations#nsa-storing-entire-countries-phone-communications-for-30-days ,NSA,Global (including Kenya),,,,,
2013 FISA Court order authorised spying on communications related to “Germany”,,https://freesnowden.is/revelations#2013-fisa-court-order-authorised-spying-on-communications-related-to-germany ,NSA,Germany,,,,,
GCHQ presents its plans for using social media,,https://freesnowden.is/revelations#gchq-presents-its-plans-for-using-social-media ,GCHQ,Global,,,,,
Norway acquires a supercomputer for cryptanalysis,,https://freesnowden.is/revelations#norway-acquires-a-supercomputer-for-cryptanalysis ,NIS,Norway,,,,,
GCHQ sought “unsupervised access” to PRISM data,,https://freesnowden.is/revelations#gchq-sought-unsupervised-access-to-prism-data ,GCHQ,Global,,,,,
More targets of Upstream collection revealed,,https://freesnowden.is/revelations#more-targets-of-nsa-upstream-collection-revealed ,NSA,"The Philippines, Italy, Saudi Arabia, Libya, Pakistan, Austria, Honduras, US",,,,,
“Collect it all” is an explicit Five Eyes goal,,https://freesnowden.is/revelations#collect-it-all-is-an-explicit-five-eyes-goal ,"NSA, GCHQ, ASD, CSEC, GCSB",Global,,,,,
GCHQ and NSA aim for global coverage of in-flight phone data,,https://freesnowden.is/revelations#gchq-and-nsa-aim-for-global-coverage-of-inflight-phone-data ,"NSA, GCHQ",Global,,,,,
NSA and GCHQ recording every phone call in the Bahamas and Afghanistan,,https://freesnowden.is/revelations#nsa-recording-every-phone-call-in-the-bahamas ,"NSA, GCHQ","Bahamas, Afghanistan",,,,,
NSA harvesting online images to develop facial recognition capability,,https://freesnowden.is/revelations#nsa-harvesting-online-images-to-develop-facial-recognition-capability ,NSA,Global,,,,,
Third party countries allow NSA access to internet backbone,,https://freesnowden.is/revelations#third-party-countries-allow-nsa-access-to-internet-backbone ,NSA,"US, UK, Australia, New Zealand, Canada, Algeria, Austria, Belgium, Croatia, Czech Republic, Denmark, Ethiopia, Finland, France, Germany, Greece, Hungary, India, Israel, Italy, Japan, Jordan, Korea, Macedonia, Netherlands, Norway, Pakistan, Poland, Romania, Saudi Arabia, Singapore, Spain, Sweden, Taiwan, Thailand, Tunisia, Turkey, UAE",,,,,
FISA Court allowed NSA to surveil all but four countries,,https://freesnowden.is/revelations#fisa-court-allowed-nsa-to-surveil-all-but-four-countries ,NSA,Global,,,,,
Ordinary internet users account for most of the communications content stored by the NSA,,https://freesnowden.is/revelations#ordinary-internet-users-account-for-most-of-the-communications-content-stored-by-the-nsa ,NSA,Global,,,,,
GCHQ manipulates online polls and page views,,https://freesnowden.is/revelations#gchq-manipulates-online-polls-and-page-views ,GCHQ,Global,,,,,
Executive Order 12333 allows collection of communications content without a warrant,,https://freesnowden.is/revelations#executive-order-12333-allows-collection-of-communications-content-without-a-warrant ,NSA,Global,,,,,
GCHQ's covert mobile phones policy,,https://freesnowden.is/revelations#gchqs-covert-mobile-phones-policy ,GCHQ,Global,,,,,
Five Eyes port scanning entire countries,,https://freesnowden.is/revelations#five-eyes-port-scanning-entire-countries ,"NSA, GCHQ, CSEC",Global,,,,,
NSA sharing metadata with 23 other US government agencies,,https://freesnowden.is/revelations#nsa-sharing-metadata-with-23-other-us-government-agencies ,NSA,US,,,,,
NSA and GCHQ have direct access to the Deutsche Telekom Network,,https://freesnowden.is/revelations#nsa-and-gchq-have-direct-access-to-the-deutsche-telekom-network ,"NSA, GCHQ",Germany,,,,,
New Zealand implemented mass surveillance in 2012-2013,,https://freesnowden.is/revelations#new-zealand-implemented-mass-surveillance-in-2012-2013 ,GCSB,New Zealand,,,,,
Clandestine field operations among the NSA's “Core Secrets”,,https://freesnowden.is/revelations#clandestine-field-operations-among-the-nsas-core-secrets ,NSA,"US, South Korea, Germany, China",,,,,
Vodafone subsidiary worked with GCHQ on Tempora,,https://freesnowden.is/revelations#vodafone-subsidiary-worked-with-gchq-on-tempora ,GCHQ,Global,,,,,
Dedicated NSA units weaken and exploit mobile phone networks,,https://freesnowden.is/revelations#dedicated-nsa-units-weaken-and-exploit-mobile-phone-networks ,NSA,Global,,,,,
NSA locations in Vienna revealed,,https://freesnowden.is/revelations#nsa-locations-in-vienna-revealed ,,,,,,,
Intelligence agencies agree that encryption is necessary to protect private data,,https://freesnowden.is/revelations#intelligence-agencies-agree-encryption-necessary-protect-private-data ,,,,,,,
NSA penetrated North Korean networks in 2010,,https://freesnowden.is/revelations#nsa-penetrated-north-korean-networks-in-2010 ,,,,,,,
Canada monitoring millions of file downloads every day,,https://freesnowden.is/revelations#canada-monitoring-millions-file-downloads-every-day ,,,,,,,
How Five Eyes Agencies rely on Hackers,,https://freesnowden.is/revelations#how-five-eyes-agencies-rely-hackers ,,,,,,,
CSE collects and retains hundreds of thousands of Canadian emails every day,,https://freesnowden.is/revelations#cse-collects-retains-hundreds-thousands-canadian-emails ,,,,,,,
New Zealand spying on its neighbourhood for the Five Eyes,Maybe?,https://freesnowden.is/revelations#new-zeland-spying-neighbourhood-five-eyes ,,,,,,,
Inside Ironsand: New Zealand's Five Eyes spy base,Maybe?,https://freesnowden.is/revelations#inside-ironsand ,,,,,,,
CIA researchers working to defeat Apple encryption,,https://freesnowden.is/revelations#cia-researchers-working-to-defeat-apple-encryption ,,,,,,,
"UK launched “long-running, large scale, pioneering” information operation against Argentina",Maybe?,https://freesnowden.is/revelations#uk-launched-information-operation-argentina ,,,,,,,
New Zealand spies on – and with – Bangladesh,Maybe?,https://freesnowden.is/revelations#new-zealand-spies-on-with-bangladesh ,,,,,,,
New Zealand's spies plotted China hack with the NSA,Maybe?,https://freesnowden.is/revelations#new-zealand-plotted-china-hack-with-nsa ,,,,,,,
How the NSA uses speech-to-text technology,,https://freesnowden.is/revelations#how-nsa-uses-speech-to-text ,,,,,,,
Spy agencies planned to implant spyware on phones using app stores,Maybe?,https://freesnowden.is/revelations#spy-agencies-planned-implant-spyware-phones-app-stores,,,,,,,
Industrial espionage in Brazil,done,https://freesnowden.is/revelations#industrial-espionage-in-brazil ,NSA,"Brazil, Colombia, Venezuela",,"Boundless Informant, Xkeyscore, PRISM","Data collection, Data mining","Email, Chat, Videos, Photos, Stored data, VoIP, File transfers, Video conferencing, Logins, Online social networking details, Special requests","Microsoft, Google, Apple, Facebook, Yahoo, AOL, PalTalk, Skype, YouTube"
